{
  "$schema": "https://json-schema.org/draft/2020-12/schema",
  "$id": "https://goodcommit.dev/schemas/gpp-manifest.schema.json",
  "title": "Goodcommit Plugin Manifest v1",
  "type": "object",
  "required": ["api_version", "kind", "id", "version", "entrypoint", "hooks"],
  "properties": {
    "api_version": { "type": "string", "const": "goodcommit.io/v1" },
    "kind": { "type": "string", "const": "Plugin" },
    "id": {
      "type": "string",
      "pattern": "^[a-z0-9][a-z0-9._-]*/[a-z0-9][a-z0-9._-]*$"
    },
    "name": { "type": "string", "minLength": 1 },
    "version": { "type": "string", "minLength": 1 },
    "description": { "type": "string" },
    "homepage": { "type": "string", "format": "uri" },
    "repository": { "type": "string", "format": "uri" },
    "license": { "type": "string" },
    "protocol_versions": {
      "type": "array",
      "items": { "type": "string" },
      "minItems": 1
    },
    "entrypoint": {
      "type": "object",
      "required": ["type", "command"],
      "properties": {
        "type": { "type": "string", "enum": ["exec"] },
        "command": { "type": "string", "minLength": 1 },
        "args": { "type": "array", "items": { "type": "string" } },
        "env": {
          "type": "object",
          "additionalProperties": { "type": "string" }
        }
      },
      "additionalProperties": false
    },
    "hooks": {
      "type": "array",
      "items": {
        "type": "string",
        "enum": [
          "collect",
          "validate",
          "enrich",
          "finalize",
          "pre_commit",
          "post_commit"
        ]
      },
      "minItems": 1,
      "uniqueItems": true
    },
    "permissions": {
      "type": "object",
      "properties": {
        "network": { "type": "boolean", "default": false },
        "git_read": { "type": "boolean", "default": true },
        "git_write": { "type": "boolean", "default": false },
        "filesystem_read": {
          "type": "array",
          "items": { "type": "string" }
        },
        "filesystem_write": {
          "type": "array",
          "items": { "type": "string" }
        },
        "secrets": {
          "type": "array",
          "items": { "type": "string" }
        }
      },
      "additionalProperties": false
    },
    "ai_hints": {
      "type": "object",
      "required": ["purpose"],
      "properties": {
        "purpose": { "type": "string" },
        "instructions": { "type": "string" }
      },
      "additionalProperties": false
    },
    "contract": {
      "type": "object",
      "properties": {
        "answers": {
          "type": "array",
          "items": {
            "type": "object",
            "required": ["key", "description"],
            "properties": {
              "key": { "type": "string" },
              "description": { "type": "string" },
              "type": { "type": "string" },
              "required": { "type": "boolean", "default": false },
              "strategy": { "type": "string" }
            },
            "additionalProperties": false
          }
        },
        "metadata_reads": {
          "type": "array",
          "items": {
            "type": "object",
            "required": ["key"],
            "properties": {
              "key": { "type": "string" },
              "description": { "type": "string" },
              "required": { "type": "boolean", "default": false }
            },
            "additionalProperties": false
          }
        },
        "metadata_writes": {
          "type": "array",
          "items": {
            "type": "object",
            "required": ["key"],
            "properties": {
              "key": { "type": "string" },
              "description": { "type": "string" },
              "required": { "type": "boolean", "default": false }
            },
            "additionalProperties": false
          }
        },
        "trailer_writes": {
          "type": "array",
          "items": {
            "type": "object",
            "required": ["key"],
            "properties": {
              "key": { "type": "string" },
              "description": { "type": "string" },
              "required": { "type": "boolean", "default": false }
            },
            "additionalProperties": false
          }
        }
      },
      "additionalProperties": false
    },
    "config_schema": {
      "type": "object"
    }
  },
  "additionalProperties": false
}
